{
  "$schema": "https://json-schema.org/draft/2020-12/schema",
  "$id": "vehicle.schema.json",
  "title": "AFL Autos Public Vehicle",
  "type": "object",
  "required": [
    "schemaVersion",
    "id",
    "vehicle",
    "status",
    "commercial",
    "media",
    "capture",
    "drive",
    "outputs",
    "whatsapp",
    "workflow",
    "checkpoint",
    "editPolicy",
    "promptProtocol",
    "promptMenu",
    "quickResponses",
    "operationalLinks",
    "ui",
    "recommendationPolicy"
  ],
  "properties": {
    "schemaVersion": {
      "type": "string"
    },
    "updated": {
      "type": "string"
    },
    "id": {
      "type": "string",
      "pattern": "^AFL-[A-Z0-9-]+$"
    },
    "vehicle": {
      "type": "object"
    },
    "status": {
      "type": "object"
    },
    "commercial": {
      "type": "object"
    },
    "media": {
      "type": "object"
    },
    "capture": {
      "type": "object"
    },
    "drive": {
      "type": "object"
    },
    "outputs": {
      "type": "object"
    },
    "whatsapp": {
      "type": "object"
    },
    "music": {
      "type": "object"
    },
    "workflow": {
      "type": "array",
      "items": {
        "type": "string"
      }
    },
    "deliverables": {
      "type": "array",
      "items": {
        "type": "object",
        "required": [
          "key",
          "label",
          "folder",
          "status"
        ],
        "properties": {
          "key": {
            "type": "string"
          },
          "label": {
            "type": "string"
          },
          "folder": {
            "type": "string"
          },
          "status": {
            "enum": [
              "PENDIENTE",
              "EN_PRODUCCION",
              "PROGRAMADA",
              "LISTO",
              "PUBLICADO"
            ]
          }
        }
      }
    },
    "fieldWork": {
      "type": "object"
    },
    "editPolicy": {
      "type": "object"
    },
    "checkpoint": {
      "type": "object"
    },
    "promptProtocol": {
      "type": "object"
    },
    "promptMenu": {
      "type": "array",
      "items": {
        "type": "object"
      }
    },
    "quickResponses": {
      "type": "array",
      "items": {
        "type": "object",
        "required": [
          "label",
          "field"
        ],
        "properties": {
          "label": {
            "type": "string"
          },
          "field": {
            "type": "string"
          }
        }
      }
    },
    "operationalLinks": {
      "type": "object"
    },
    "ui": {
      "type": "object"
    },
    "recommendationPolicy": {
      "type": "object"
    },
    "publication": {
      "type": "object"
    },
    "contentLab": {
      "type": "object",
      "properties": {
        "operation": {
          "type": "string"
        },
        "status": {
          "enum": [
            "EN_PRODUCCION",
            "COMPLETADO",
            "PARCIAL",
            "BLOQUEADO"
          ]
        },
        "requestedAt": {
          "type": "string"
        },
        "startedAt": {
          "type": "string"
        },
        "completedAt": {
          "type": [
            "string",
            "null"
          ]
        },
        "lastVerifiedAt": {
          "type": "string"
        },
        "timezone": {
          "type": "string"
        },
        "result": {
          "type": "string"
        },
        "filesMoved": {
          "type": "integer",
          "minimum": 0
        },
        "filesProduced": {
          "type": "integer",
          "minimum": 0
        },
        "deliverables": {
          "type": "array",
          "items": {
            "type": "string"
          }
        },
        "reposUpdated": {
          "type": "array",
          "items": {
            "type": "string"
          }
        },
        "nextAction": {
          "type": "string"
        }
      },
      "additionalProperties": true
    }
  },
  "additionalProperties": true
}
