{
  "schemaVersion": "1.1.0",
  "updated": "2026-09-27",
  "id": "AFL-279006",
  "vehicle": {
    "make": "Chevrolet",
    "model": "Colorado",
    "trim": "Work Truck",
    "year": 2016,
    "color": "Rojo",
    "publicTitle": "2016 Chevrolet Colorado Work Truck",
    "configuration": {
      "cab": "Cabina extendida",
      "engine": "2.5 L 4 cilindros gasolina",
      "transmission": "Manual 6 velocidades",
      "drivetrain": "4x2"
    }
  },
  "status": {
    "vehicle": "CAPTURA_PENDIENTE",
    "materialReview": "COMPLETADA",
    "classification": "COMPLETADA",
    "captureType": "COMPLETA",
    "captureExecution": "PENDIENTE",
    "whatsapp": "OCULTO",
    "outputsDrive": "PREPARADAS",
    "publish": false
  },
  "commercial": {
    "priceInternal": 325000,
    "currency": "MXN",
    "catalogPrice": null,
    "catalogPricePolicy": "OMITIR"
  },
  "media": {
    "totalJpeg": 252,
    "unique": 62,
    "approvedUnique": 61,
    "commercialCandidates": 52,
    "privateNoPublish": 9,
    "duplicates": 190,
    "rejected": 1,
    "realVideo": false,
    "whatsappSelectedPhotos": 8
  },
  "capture": {
    "scheduled": true,
    "source": "GOOGLE_CALENDAR",
    "date": "2026-09-28",
    "start": "10:00",
    "end": "11:00",
    "timezone": "America/Mexico_City",
    "type": "CAPTURA_COMERCIAL_COMPLETA",
    "checklist": [
      "HERO 3/4 frontal",
      "Frente recto",
      "3/4 frontal opuesto",
      "Perfil izquierdo 90°",
      "Perfil derecho 90°",
      "3/4 trasero izquierdo",
      "3/4 trasero derecho",
      "Trasera recta",
      "Cabina extendida con puertas abiertas",
      "Caja cerrada",
      "Caja abierta",
      "Interior de caja",
      "Cabina conductor",
      "Cabina pasajero",
      "Tablero encendido",
      "Volante y controles",
      "Palanca manual",
      "Asientos delanteros",
      "Segunda fila",
      "Compartimiento de motor",
      "Rin/neumático delantero",
      "Rin/neumático trasero"
    ],
    "requiredVideo": {
      "format": "9:16",
      "walkaroundSeconds": "20-30",
      "shots": [
        "HERO",
        "Frontal a lateral",
        "Perfil",
        "3/4 trasero",
        "Trasera",
        "Caja cerrada",
        "Caja abierta",
        "Interior/tablero",
        "Palanca manual"
      ]
    },
    "privateEvidence": [
      "VIN",
      "Etiqueta técnica",
      "Odómetro",
      "Documentos"
    ]
  },
  "drive": {
    "inputRoot": "01_ENTRADAS/AFL-279006",
    "inputUrl": "https://drive.google.com/drive/folders/1gOTd4dH0gEku8gwhSY4HsDb0pawqzcd3",
    "outputRoot": "02_SALIDAS/AFL-279006",
    "outputUrl": "https://drive.google.com/drive/folders/1OsedwLkSZvCvaefURlWl7vTNNIf_0za1",
    "inputs": [
      "00_MATERIAL_DISPONIBLE_LOCAL",
      "10_APROBADOS",
      "20_NUEVA_CAPTURA",
      "90_RECHAZADOS",
      "95_DUPLICADOS"
    ],
    "outputs": [
      "00_CONTENIDO_DISPONIBLE",
      "10_MARKETPLACE",
      "20_IMAGENES_COMERCIALES",
      "30_POST",
      "40_FEED",
      "50_HISTORIAS",
      "60_PORTADAS",
      "70_REEL",
      "80_TIKTOK",
      "90_WHATSAPP_OCULTO",
      "95_PARA_ENVIAR"
    ],
    "controlDocument": "AFL-279006 — CONTROL OPERATIVO",
    "newCaptureUrl": "https://drive.google.com/drive/folders/1tqYlaV-fh3AzwaUiDUMb9n4Ym4OnbXw-",
    "controlDocumentUrl": "https://docs.google.com/document/d/1F8NObkJi9fixcsmSrLrmz4GX9-ejVHqvSMWRZbERwIs/edit"
  },
  "outputs": {
    "marketplace": "EN_PRODUCCION",
    "images": "PENDIENTE",
    "post": "PROGRAMADA",
    "feed": "EN_PRODUCCION",
    "stories": "PENDIENTE",
    "covers": "PENDIENTE",
    "reel": "PENDIENTE",
    "tiktok": "PENDIENTE",
    "whatsapp": "OCULTO",
    "sendPackage": "PENDIENTE"
  },
  "whatsapp": {
    "status": "OCULTO",
    "title": "2016 Chevrolet Colorado Work Truck",
    "description": "Chevrolet Colorado Work Truck 2016 de cabina extendida, motor 2.5 L de 4 cilindros a gasolina, transmisión manual de 6 velocidades y tracción 4x2.",
    "price": null,
    "selectedPhotos": 8,
    "realVideo": false,
    "targetState": "WHATSAPP_OCULTO_LISTO"
  },
  "music": {
    "registry": "data/musica-usada.json",
    "rule": "EVITAR_AUDIO_PUBLICADO"
  },
  "workflow": [
    "CAPTURA_COMERCIAL_COMPLETA",
    "MATERIAL_NUEVO_SUBIDO",
    "REVISION_MATERIAL",
    "SELECCION_FINAL",
    "CAPTURA_COMPLETA",
    "WHATSAPP_OCULTO_LISTO",
    "CONTENIDO_DISPONIBLE"
  ],
  "deliverables": [
    {
      "key": "contentAvailable",
      "label": "Contenido disponible",
      "folder": "00_CONTENIDO_DISPONIBLE",
      "status": "PENDIENTE",
      "url": "https://drive.google.com/drive/folders/1YlbZRy8_YvnNdUN2h0IWmWKxHRn9jiPs"
    },
    {
      "key": "marketplace",
      "label": "Marketplace",
      "folder": "10_MARKETPLACE",
      "status": "EN_PRODUCCION",
      "url": "https://drive.google.com/drive/folders/1CVD3zkzj3RTN9ZqjZ6N0VCHv5ibsnzqE"
    },
    {
      "key": "images",
      "label": "Imágenes comerciales",
      "folder": "20_IMAGENES_COMERCIALES",
      "status": "PENDIENTE",
      "url": "https://drive.google.com/drive/folders/1K36PRof8nxFp2KmvRdoG45Bp3842aFzT"
    },
    {
      "key": "post",
      "label": "Post",
      "folder": "30_POST",
      "status": "PROGRAMADA",
      "url": "https://drive.google.com/drive/folders/16xMBQIiojE2Ugg05pvmbP0ZLMY6186S_"
    },
    {
      "key": "feed",
      "label": "Feed",
      "folder": "40_FEED",
      "status": "EN_PRODUCCION",
      "url": "https://drive.google.com/drive/folders/1FDvj03RfScOy-SKOyjCrOfX6ZR2CDRw8"
    },
    {
      "key": "stories",
      "label": "Historias",
      "folder": "50_HISTORIAS",
      "status": "PENDIENTE",
      "url": "https://drive.google.com/drive/folders/1pR1tPQTSQUMJ2NjtjzOCC9wPIwreT1ES"
    },
    {
      "key": "covers",
      "label": "Portadas",
      "folder": "60_PORTADAS",
      "status": "PENDIENTE",
      "url": "https://drive.google.com/drive/folders/1H7ZL5fuA3iclLKDj9fXVDWfNax96D-8O"
    },
    {
      "key": "reel",
      "label": "Reel",
      "folder": "70_REEL",
      "status": "PENDIENTE",
      "url": "https://drive.google.com/drive/folders/16jBksEfg4enxYOgSIWt5RxKbBfPKo5MI"
    },
    {
      "key": "tiktok",
      "label": "TikTok",
      "folder": "80_TIKTOK",
      "status": "PENDIENTE",
      "url": "https://drive.google.com/drive/folders/1I2pSaLjhYqKphUd1zDJsR1yqXWyXnrzd"
    },
    {
      "key": "whatsapp",
      "label": "WhatsApp oculto",
      "folder": "90_WHATSAPP_OCULTO",
      "status": "PENDIENTE",
      "url": "https://drive.google.com/drive/folders/1K1Kt-pkq1uNdErq4Jt3pxTih94UEwB1M"
    },
    {
      "key": "sendPackage",
      "label": "Para enviar",
      "folder": "95_PARA_ENVIAR",
      "status": "PENDIENTE",
      "url": "https://drive.google.com/drive/folders/1PMhiN4lqT5aBj1YmDXC2cYqOtwR2oaX8"
    }
  ],
  "fieldWork": {
    "status": "PROGRAMADA",
    "canonicalState": "CAPTURA_PENDIENTE",
    "nextAfterUpload": "MATERIAL_NUEVO_SUBIDO",
    "uploadFolder": "20_NUEVA_CAPTURA",
    "completionRule": "No cambiar a CAPTURA_COMPLETA hasta revisar material nuevo y cubrir faltantes obligatorios",
    "lastEvidenceCheck": {
      "checkedAt": "2026-09-27T14:38:00-06:00",
      "folder": "01_ENTRADAS/AFL-279006/20_NUEVA_CAPTURA",
      "result": "VACIA_REVALIDADA",
      "materialNewUploaded": false,
      "stateTransition": false,
      "requiredAction": "CAPTURA_COMERCIAL_COMPLETA y subir el material nuevo únicamente a 20_NUEVA_CAPTURA"
    }
  },
  "checkpoint": {
    "phase": "PRECAPTURA_CON_BORRADORES",
    "state": "CAPTURA_PENDIENTE",
    "updated": "2026-09-27",
    "lastCompleted": "REVALIDACION_EVIDENCIA_20_NUEVA_CAPTURA_VACIA; sin transición de estado.",
    "nextAction": "CAPTURA_COMERCIAL_COMPLETA",
    "resumeFrom": "Realizar trabajo de campo con el checklist comercial completo de 22 fotos y video vertical 9:16; usar el enlace Subir nueva captura para cargar material únicamente en 01_ENTRADAS/AFL-279006/20_NUEVA_CAPTURA.",
    "driveControlDocument": "AFL-279006 — CONTROL OPERATIVO",
    "lastVerifiedAt": "2026-09-27T14:38:00-06:00"
  },
  "promptProtocol": {
    "purpose": "Continuar una unidad desde el último checkpoint sin depender de la memoria del chat.",
    "minimalSources": [
      "data/vehicles/AFL-279006.json",
      "data/vehicles/index.json",
      "ACTIVOS/AFL-279006/ESTADO.md",
      "ACTIVOS/AFL-279006/PLAN_CONTENIDO.md",
      "Drive: 01_ENTRADAS/AFL-279006",
      "Drive: 02_SALIDAS/AFL-279006",
      "Drive: documento AFL-279006 — CONTROL OPERATIVO"
    ],
    "afterEveryPrompt": [
      "Actualizar en Drive los archivos/documentos afectados y el CONTROL OPERATIVO del vehículo.",
      "Actualizar data/vehicles/AFL-279006.json con el nuevo checkpoint y estados.",
      "Actualizar data/vehicles/index.json para que HOME refleje el checkpoint, estado y siguiente acción.",
      "Actualizar los .md operativos relevantes cuando corresponda.",
      "Verificar que Drive, JSON del vehículo y HOME coincidan antes de cerrar.",
      "Mostrar en el chat, después del cierre, el submenú operativo recomendado y enlaces clicables del vehículo.",
      "Incluir siempre enlaces para: subir nueva captura, opciones del vehículo, abrir otro vehículo, nuevo vehículo y regresar a ROOT GLOBAL.",
      "Mostrar la miniatura pública del vehículo al inicio de la respuesta relacionada con la unidad, cuando el cliente permita imágenes.",
      "Detectar el patrón operativo y dejar que el ChatGPT actual determine la recomendación; el repo aporta estado/evidencia y navegación.",
      "Si el prompt es de edición autorizada, informar valor anterior/nuevo y conservar checkpoint salvo autorización específica.",
      "Después de PROGRAMAR, PUBLICAR o ejecutar una acción de cambio autorizada, actualizar siempre data/vehicles/index.json para que HOME refleje el cambio.",
      "Cuando exista fecha/hora programada, sincronizar también data/programador.json con la fuente real de programación.",